{
  "$schema": "schema/tutorial.schema.json",
  "_comment": "FTUE script: the six-step first run of docs/05-UX_FLOW.md section 4, under 60 s, no store / ads / pass, one panel deep. Steps 1-5 are one scripted turn (level_001's first clear) on the 1-zone starter grill; step 6 is on Home. Run by tools/sim-core/src/tutorial.ts (TutorialDirector + TutorialTurn), tested in tools/studio/test/tutorial.test.ts, cross-checked by npm run validate (ids, l10n keys, analytics events, step-6 affordability).",
  "_coach": "flipPromptAtSideDoneness: the flip prompt waits for a browned face-down side (docs/20: 'espere dourar'). serveReadyMinDoneness: the serve prompt waits until a serve scores PERFEITO. holdBelowWindowHi: while the guided plate waits for its flip or serve, no side passes perfectWindow[1] minus this, so it can neither overcook nor burn (docs/19 section 6). idleHintSec: step 5 has no prompt; the hand returns after this much idle time.",
  "version": 1,
  "variant": "six_step_v1",
  "targetDurationSec": 60,
  "turn": {
    "levelId": "level_001",
    "churrasqueiraId": "lata_valente",
    "ingredientId": "linguica_toscana",
    "customers": [
      { "customerId": "comum", "order": ["linguica_toscana"] },
      { "customerId": "vizinho", "order": ["linguica_toscana"] }
    ],
    "customerPatienceSec": 900,
    "safetyLimitSec": 600,
    "windDownSec": 1.2
  },
  "coach": {
    "flipPromptAtSideDoneness": 0.55,
    "serveReadyMinDoneness": 0.74,
    "holdBelowWindowHi": 0.02,
    "idleHintSec": 4,
    "handLoopSec": 0.9
  },
  "skip": {
    "showAfterSec": 2,
    "hitSizePx": 48,
    "labelKey": "ui.tut.skip"
  },
  "_school": "Escola da Brasa — the first-impression lesson deck. A lesson with a `step` also shows as a two-line card (`shortKey`) while that guided step is on screen; the full deck plays once right after the scripted turn and pays `rewardXp`, which is enough to reach level 2 on a fresh save (the second cut unlocks, so session 1 ends with something new to cook). Re-openable from Home, where it never pays again. Geometry/drawing: prototype/src/school-ui.ts.",
  "school": {
    "rewardXp": 60,
    "titleKey": "ui.school.title",
    "openKey": "ui.school.open",
    "lessons": [
      { "id": "brasa", "icon": "bench", "step": "place", "titleKey": "ui.school.brasa.title", "bodyKey": "ui.school.brasa.body", "shortKey": "ui.school.brasa.short" },
      { "id": "ponto", "icon": "flame", "step": "flip", "titleKey": "ui.school.ponto.title", "bodyKey": "ui.school.ponto.body", "shortKey": "ui.school.ponto.short" },
      { "id": "servir", "icon": "customer", "step": "serve", "titleKey": "ui.school.servir.title", "bodyKey": "ui.school.servir.body", "shortKey": "ui.school.servir.short" },
      { "id": "combo", "icon": "coin", "step": "perfect", "titleKey": "ui.school.combo.title", "bodyKey": "ui.school.combo.body", "shortKey": "ui.school.combo.short" },
      { "id": "reposicao", "icon": "charcoal", "titleKey": "ui.school.reposicao.title", "bodyKey": "ui.school.reposicao.body" },
      { "id": "progresso", "icon": "xp", "titleKey": "ui.school.progresso.title", "bodyKey": "ui.school.progresso.body" }
    ]
  },
  "upgradeTrackId": "grill_size",
  "steps": [
    { "id": "place", "index": 1, "screen": "play", "gesture": "drag", "completesOn": "placed", "event": "tutorial_step" },
    { "id": "flip", "index": 2, "screen": "play", "gesture": "tap", "completesOn": "flipped", "event": "tutorial_step", "hintKey": "ui.tut.flip" },
    { "id": "serve", "index": 3, "screen": "play", "gesture": "drag", "completesOn": "served", "event": "tutorial_step", "hintKey": "ui.tut.serve" },
    { "id": "perfect", "index": 4, "screen": "play", "gesture": "none", "completesOn": "reward_landed", "event": "tutorial_step" },
    { "id": "order", "index": 5, "screen": "play", "gesture": "none", "completesOn": "order_completed", "event": "tutorial_complete" },
    { "id": "upgrade", "index": 6, "screen": "home", "gesture": "tap", "completesOn": "upgrade_bought", "event": "tutorial_step", "hintKey": "ui.tut.upgrade" }
  ]
}
